{
  "schemaVersion": 1,
  "contractVersion": 1,
  "escrowSchemaVersion": 1,
  "network": "testnet",
  "networkPassphrase": "Test SDF Network ; September 2015",
  "rpcEnvironment": "SDF public testnet RPC",
  "source": {
    "commit": "a9d09f9bf4890d6093803be6d1a62fe5d460a2b2"
  },
  "toolchain": {
    "rust": "1.97.1 (8bab26f4f 2026-07-14)",
    "sorobanSdk": "27.0.2",
    "stellarCli": "27.0.0 (5a7c5fe76530bf4248477ac812fc757146b98cc4)",
    "stellarXdr": "27.0.0 (5262803470be965e42f80023d12fba12808c774a)",
    "protocol": 27
  },
  "artifact": {
    "path": "contracts/target/wasm32v1-none/release/movix_escrow.wasm",
    "sizeBytes": 19617,
    "sha256": "a6c938a6148a7fd0cc768eee25088ef66822243c05e71516e1400d9bc18bd498",
    "optimized": true
  },
  "bindings": {
    "path": "packages/stellar/generated/escrow",
    "command": "pnpm.cmd contracts:bindings",
    "sha256": "066d15c46562c1ca29630ae59615eb3ac6f29cd058bf7b95852ef09b43930cf8"
  },
  "deployment": {
    "contractId": "CCEECHOGV6MXZANAOLJNDMA2GPEBDETPNWUR4XDEW32KHJUYN3V5ZAP5",
    "transactionHash": "bc0752d467e9154c3e35fd2b1ea68d0f5fd8b8afba63a011f11ce271230a13f5",
    "ledger": 3841429
  },
  "constructor": {
    "treasury": "GBNGA4F7BGTSYHIJEJFD2RKPFZNVVGB7ALLQZHAIZRKHSSXXVABDREQU",
    "maxFeeBps": 0,
    "pilotFeeBps": 0,
    "ttl": {
      "threshold": 120960,
      "extendTo": 1555200,
      "networkLimitReference": "docs/contracts/escrow-v1/resource-budgets.json"
    }
  },
  "assets": {
    "XLM": {
      "code": "XLM",
      "issuer": null,
      "sac": "CDLZFC3SYJYDZT7K67VZ75HPJVIEUVNIXF47ZG2FB2RMQQVU2HHGCYSC"
    },
    "USDC": {
      "code": "USDC",
      "issuer": "GBBD47IF6LWK7P7MDEVSCWR7DPUWV3NY3DTQEVFL4NAT4AQH3ZLLFLA5",
      "sac": "CBIELTK6YBZJU5UP2WWQEUCYKLPU6AUNZ2BQ4WWFEIE3USCIHMXQDAMA"
    }
  },
  "evidenceIndex": "docs/evidence/sprint-03/README.md",
  "deployedAt": "2026-07-28T08:04:07.000Z",
  "testnetOnly": true
}
